{
  "type": "web4:Repository",
  "identity": {
    "provider": "github",
    "owner": "octocat",
    "name": "Hello-World",
    "canonical": "github:octocat/Hello-World"
  },
  "source": {
    "url": "https://github.com/octocat/Hello-World",
    "api": "https://api.github.com/repos/octocat/Hello-World",
    "clone": "https://github.com/octocat/Hello-World.git",
    "ssh": "git@github.com:octocat/Hello-World.git"
  },
  "content": {
    "description": "My first repository on GitHub!",
    "language": null,
    "default_branch": "master"
  },
  "status": {
    "visibility": "public",
    "fork": false,
    "archived": false,
    "disabled": false
  },
  "metrics": {
    "stars": 0,
    "forks": 0,
    "watchers": 0,
    "open_issues": 0
  },
  "provenance": {
    "provider": "github",
    "repository_id": 1296269,
    "node_id": "MDEwOlJlcG9zaXRvcnkxMjk2MjY5",
    "created_at": "2011-01-26T19:01:12Z",
    "updated_at": "2026-09-18T00:00:00Z",
    "pushed_at": "2026-09-18T00:00:00Z"
  }
}
